{
  "handshakes": 79572,
  "handshakes_failed": 21025,
  "session_reuses": 15762,
  "no_common_protocol": 4,
  "no_common_cipher": 2,
  "handshake_timeout": 0,
  "peer_rejected_cert": 0,
  "verify_failures": {
    "no_cert": 0,
    "expired_cert": 2,
    "revoked_cert": 1,
    "hostname_mismatch": 2,
    "other": 1
  }
}
